Complaint,Count
Would be funny if this was a fake render planted by Nothing like the 2a render,1
I like the way they both look but that camera module on the 3a Pro is hideous and triggers my trypophobia,1
i might buy just to support,1
capacity battery the 6 77 inch 120Hz display lol OPPO just put out a foldable with a bigger battery than this,1
Nice to see 3 usable hopefully cameras in this price range A lot of manufacturers pack in a useless 2mp macro lens that no one uses just to up the number,1
Interesting if the camera is better than the one on my x80 then I might upgrade,1
These are obviously not coming to the United States so I have little reason to care since I live in the US I know most people on this sub are Indians or Europeans though lmao,1
The 3 a pro why does it exist Like a pro version of a midrange phone Edit if the nothing team read this I know you guys are on here Genuinely interested to know I know you ll have a reason I m just itching to get my hands on the phone 3,1
Mountain Dew Diet Double Dew Edition,1
Separate phone though at this point I wonder if it has any other upgrades besides the SOC,1
I mean the cpu on the 3a pro barely improve the performance of the regular 2a it would be weird to call that a flagship only the cameras deserve a pro naming,1
Idk the 3a Pro s camera placement looks really haphazard I still don t get why Nothing hasn t figured out how to integrate the flash as one of the Glyph lights,1
Assume you mixed them up The weird one is the 3a Pro,1
I literally said yuck and visibily cringed when I saw the renders It s definitely not my cup of tea,1
Still better than pixel 9 looking like amongus guys,1
I thought the 2a looked awesome I understand the camera placement being controversial but apart from that it s a very unique design,1
It s subjective like all design Huge camera array of mostly empty space They somehow made it worse than the other Nothing Phones which had a more subtle circular area Part of it s the huge lip this time around Or how the glyphs that appear to be an after thought more so than prior models Nothing is striking out here They seem adrift They aren t releasing their phones in logical order e g no Phone 3 jumping straight to 3a to compete with Google s Pixel branding Second they pulled dirty tricks in their unveiling video with the camera tests to make iPhone look much much worse than this phone Which begs the question why are the constantly comparing their phone to the top flagship phone This is squarely aimed at budget middle market devices That s why they have to cheat to look better,1
It looks unique and fun There is thousands of boring phone nice there is new funnier brand,1
Sony Xperia is closest,1
wait for pixel 9a or iphone 16e,1
They didn t have one from the beginning,1
Looks like they wanted to differentiate their phones too much that they strayed onto weird category,1
Have you seen their YouTube video comparing this phone the actual device blurred out in the video like it is something secret and scandalous to the iPhone Nothing cheated and was deceptive in their real world comparison They got called out by their own fans because they did things like choose the iPhone s ultra wide lens and placed it in a dark setting so it was optically zoomed way out and grainy while setting the Nothing Phone 3a to its peak settings non ultra wide no digital zoom unlike what they did with iPhone They forgot to blur or not show the camera settings being used on the iPhone in the viewfinder which gave them away I really really like their UI design I like an underdog But being so brazen and underhanded really turned me off of the brand If they will be deceptive about little stuff like that and undermine their entire credibility since they aren t a luxury phone maker why should I trust them on bigger stuff 8MP is too damn low which his why their had to deceive people Shitty tablets that are definitely cheaper than this phone have higher megapixel cameras,1
Repairability and upgradability still leave a LOT to be desired I may sound radical by phrasing it this way but simply put as the climate crisis continues to eat up coastal cities we will become more conscious about how often we are replacing things we purchase Having a Framework phone if you re familiar with the framework laptop it is entirely modular and upgradable across all hardware where you can replace the battery and screen and upgrade the camera modules etc etc that s where this all must lead If it comes in the form of goggles or glasses or whatever that is fine But they mustn t be made in a way that requires habitual purchases The trash simply doesn t go anywhere and there s a point of no return that we will eventually reach in terms of the amount of trash we produce and what it does to the earth air and ocean Again I totally understand I sound a bit out there and radical but this is the unfortunate reality and we already see that reality influencing laws such as a customer s right to repair Apple being forced to adopt USB C to essentially eliminate proprietary phone plugs etc But eventually hard to repair glass sandwiches won t suffice and either customers or environmental circumstance will force a change,1
Next we ll be integrating buttons back into mainstream lol blackberry resurgence,1
Asymmetric maybe But ugly I think not It definitely has its own unique style and personality,1
It s like they generated it with craiyon and were like yup that ll do,1
Yeh I don t get the glyph lights I got my kid a 2a cos I thought he d be impressed by the lights and shit He s had them turned off ever since he got it lol,1
Nope The glyph lights needs to go and replace with something more useful,1
Why is that surprising Bigger phone means more space for battery,1
2a is available in the US,1
Trial run a periscope before they put it on on their phone 3 they haven t even done a regular telephoto before,1
definitely bigger ultrawide than a dinky 8MP,1
Likely also wireless charging and esim,1
Maybe their AI stuff,1
You can actually use glyphs as flash light already,1
I probably did That article s photo placements aren t great,1
These are the opposite of sleek is all More turning to a pure cyber industrial aesthetic,1
I m in a country that s VERY pro Apple and VERY anti Android yet on 3 different occasions I ve seen someone using the 2a and on 2 different occasions I ve been asked about my Nothing Ear 1s people can make fun of Pei for copying Apple so much but holy shit does it actually work I m all for it tbh my mom wanted to get a phone for her home business I suggested the 2a she loved it his time at OnePlus has surely taught him that selling to sweaty tech enthusiasts doesn t make money selling to the average consumer definitely does,1
Using 2a now it does attract some attention I have people asking me what phone is that especially when scanning QR codes,1
I own a 2a and I wasn t a fan of the design at first but it has really grown on me I think the 3a design just doesn t work Not terrible or anything but with the extra camera it s just like a slightly deformed Google Pixel It doesn t have the eyes anymore it s not as unique and the camera bump looks too far down The 3a Pro looks really good thought I hope it will have a white version,3
I am but I m not hopeful I have an iPhone right now but I m itching to jump back to android Just waiting for that perfect phone There s some foldable sim really digging I had the z fold but it just didn t hit the right spot The latest oppo has me drooling but the damn camera bumps Sony too has me considering it but too tall My iPhones hitting the upgrade age again Hopefully this year or next I get the android I want,1
Tf do you mean how,1
Like my ex girlfriend,1
After the initial oh that s different you realise they re on the wrong side to be useful and pretty childish,1
It s not really bigger by terms of volume N5 is 4 21mm lol this is likely gonna be around 8mm,1
Wasn t it only a limited sale I know 3rd party Amazon sellers offer it here unofficially,1
My experience is Ultra Wide looks arse no matter what never use it on my One Plus 11,1
That would be a major downgrade if itbhad wireless charging Waste of internal phone space and cost bloat,1
Having no esim is what s stopping me from buying a nothing phone,1
No wireless charging they say,1
Yeah but I m sure the vast majority of their AI is just using Gemini or open AI stuff white label and then maybe some tweaks Just like Galaxy AI doesn t really use any Samsung proprietary generative AI models It s not to say they can t do anything interesting but I would temper my expectations Especially since as we see with the s25 ultra you need to have 4 GB of RAM always at the ready that can t be used for anything else to accommodate Galaxy AI And Google say hi with Gemini So like the s25 ultra with 12 GB of RAM effectively is only 8 GB of RAM if you don t care about AI If you re not using the AI it s not like the phone can take those 4 GB of RAM and use them for anything else Gary explains as a great video about this and it makes me really frustrated that Samsung only included 12 GB of RAM especially since stuff like the Note 20 ultra and the Note 10 Plus at 12 GB of RAM,1
Damn that s impressive what country if you don t mind me asking,1
N5 is 4 21 on each side So double that,1
I don t think it s going to be anything interesting if it is their AI solution but I do kinda think they re forced to have one if the reports statistics suggest people do want AI stuff on their phones I personally don t care for it,1
the UAE anyone that makes above say 2000 a month I d say 80 chance they use an iphone anecdotally when Huawei was on the rise people started switching to Huawei phones then the ban happened and the last time I ve seen a Huawei phone was the P30 Pro,1
Which is barely thicker than this is gonna be Maybe 5mm thicker With a smaller screen Volume wise it s smaller than this nothing phone,1
Oh that s pretty interesting given the wealth disparity there,1
yep I work in retail and out of 22 of my coworkers 20 have an iphone old or new doesn t matter funnily enough we don t have the same iMessage problem the US has cuz when WhatsApp was gaining popularity in 2011 2012 the market share was maybe 20 30 iPhone while a good 30 40 used BlackBerries and the rest used either Samsungs or Sonys so iMessage never really took off here WhatsApp was available on all 3 platforms and was also free those stats are purely pulled out of my ass but that s what I remember seeing and experiencing first hand iPhones didn t gain strong popularity until maybe the iPhone 6 s that Rose Gold finish was an instant success,3
That s interesting like in the US 90 of high school students use an iPhone And I remember back in 2013 I was at an ad agency digital media department and every single person in the department except me had an iPhone I think 17 people,1
Must admit i really getting confused with the way they are naming these latest Nothing phones,1
I m thinking of replacing my Pixel 6 with either a device from the 3a series or the Pixel 9a but the 3a Pro feels a bit underwhelming for its price I m eagerly looking forward to the 3a review,1
The lyt600 not being able to do 4k30 or even 1080p60 is really damning It would be understandable if it was the base 3a My current phone using the same periscope sensor on a weaker 7sGen2 can do 4k30 Nothing s first foray into telephoto is off to a shaky start,1
My current phone is a Nothing I haven t been that impressed with it for various reasons I m considering buying a BlackView phone next as I just like the idea of a rugged phone with a big battery and I just like the idea of a thermal camera built in That said I might be making the same mistakes again,1
The S24 FE seems like a better buy for most imo I got one myself on sale for around the same price as this phone and it has both a longer amount of promised software updates and a better chip,1
So this gets a rating of 4 3 the same as the Galaxy S25,1
Based on my eyes I can ten the 2 stands for the two cameras and the 3 stands for the 3 cameras but that s just an observation cause then why did they never come out with a 1 with one camera,1
wish these were on sale on the google Fi store,1
HELP Nothing 3a Stuck in Bootloop After Root Attempt by u Economy _Topic _5370 in androidroot Oh look a Nothing 3a post maybe I can find some help here,1
I d love to support Nothing in their mission and bringing competition The YT videos they make are pretty cool But until they release a smallish sized phone I don t see myself owning one It s a shame but maybe one day it happens,1
Liking mine so far,1
I can t deal with 256gb storage with no micro SD They either need a 512gb version or allow it to have microsd Because of those limitations its not really a pro phone,1
Yeah 3a pro is a pro version of the budget version except the non budget version doesn t exist,1
I haven t been this confused since the Nexus 6P and 5X came out at the same time,1
This of the Samsung A series as nothing a series and Samsungs S series as their digit series The phones that they released are lite phones the flagship is yet to come out,1
3a pro definitely is underwhelming for its price even more so when its only marginally better chipset performance than the 2a plus like sure it has better cams and other newer stuff slapped into it Im so fucking pissed that they replaced DM7350 for SD7s G3 and alot of reviewers i see are just then saying that ohhh 3a is upgraded from 2a because its now snapdragon not dimensity anymore oh hoo hoo SD7S is supposed to be qualcoms 2nd tier flagship it barely outperforms mtk s 3rd tier chips on max performance not even better in power efficiency and is blown out by DM8000 series Carl really should have stuck with dimensity on his a phones damn maybe this is just a dimensity glaze post,1
Wait for pixel 9a after using a Pixel other phones will feel buggy or underwhelming,1
hah i have a blackview BL8000 and consider moving to an nothing phone because im unhappy with the blackview its to bulky some features dont work stepcounter NFC paying the batterylife is nice but last couple of weeks its been draining much faster as in you need to charge at the end of the day,1
your self awareness is wholesome lol,1
The regular 3A is a much better value buy,1
Idk how it makes sense UFS 2 1 No wireless charging No increase in battery capacity or silicon carbon battery No 5 6 of software updates Front camera is still 1080p Back camera still doesn t support 4k 60,1
Right and then you look at the photos from the main camera it s really not up to par for a 450 phone the sunny photos are burned and the ones in the shadows are soft and noisy Video wise it s pretty meh as well The specs aren t that good either for the price at least compared to chinese phones It s really comes down to that periscope telephoto best in class easily but a telephoto doesn t make a phone,1
I just want an s25e,1
Judging by the specs it doesn t seem worse but hardly any improvements at all,1
256gb is indeed too small especially if you re expecting to use it for a few years,1
i heard nothing phone 3 is coming later this year what is that suppose to mean the A in 3A means alpha or something,1
They called their better last 2a 2a Plus And then switched it now to Pro,1
I find it hard to justify the pro name and the 80 jump in price from 379 to 459 based on the spec sheet The two are identical except for the telephoto camera 32MP vs 50MP selfie camera 8 128 vs 12 256 of RAM storage and 201 vs 211g in weight Nothing says the primary sensors are different as well but not enough info on that front,1
I think the confusing thing is that with both a modifier that essentially means less the a and one that means more the Plus Pro it s unclear which modifier is stronger and thus how 2a Plus should compare to a regular 2 particularly if one is newer,1
Lol OnePlus 13r costs 650 in Europe,1
The design of that phone is shit,1
You definitely have it backwards here,1
Got my first pixel 9 device and I can t recall the last time a phone has been this buggy at launch and with subsequent updates,1
Well all I ll say is no other brand of phone I ve owned has ever rebooted randomly while I m using it That said the last firmware seems to have improved a lot and I m hoping it stays the way it seems to be right now,1
Relative to price my bro,1
it makes sense because it s mid range not a flagship line,1
Spec for spec wise it s just the Realme 14 pro but with worse screen battery ip rating ufs storage And the 14 pro have some rather attractive price in some markets,1
costs half as much as the S25,1
Doesn t work with ATT correct,1
I agree that 4k 60fps is a basic spec these days but it is absolutely not a feature anyone needs in their phone 60fps is meant for slow motion use mostly used for B roll shots that are slightly slowed down If you shoot in 60fps and watch in 60fps it s very uncomfortable with how smooth the motion looks You can tell an amateur YouTuber who buys a camera based on specs instead of knowledge by whether their video is in 60fps,1
Because price trumps every other feature Most people are not buying the best but what they can afford,1
Especially calling something pro,1
It s probably like the Pixel a series 3a 8a that is just a cheaper and cut down version of the main series phone,1
It s a stupid naming scheme but the Nothing Phone 3 should surpass or equal the Nothing Phone 3a Pro in every way,1
Don t know what the A means But the Pro stands for Pro fit,1
Was it actually better I heard it was because the obscure mediatek chip they were using wasn t being produced anymore so they just made a different model,1
The storage and ram different would justify the increased price not saying the price is ok for the specs but it is a better camera double storage and more ram,1
3a pro supports esim 3a doesn t,1
Is 3a pro is much better Design is subjective but sheesh,1
It s hardly impressive even for the price Got my Moto Edge 40 in 2023 for the same price and that had 1 Faster storage and processor 2 4k recording support for the selfie and ultrawide 3 Better ultrawide camera 4 Wireless charging faster 68w wired charger that came with the phone 5 IP68 rating metal frame The 3a pro makes no sense given the only difference between that and the normal 3a is just the periscope camera They could ve done better to differentiate the Pro variant,1
Realme 14 pro doesn t even have app opening and closing animations It feels like using a powerful phone in 2017,1
people with 1200 phones don t even record in 4k60 the average social media user doesn t do it essentially nobody does it besides niche scenarios people aren t buying nothing products for 4k60 or camera in general they re doing it for an interesting phone and software experience look at their YouTube page they openly admit to not being concerned about hardware price performance they care about the experience of the phone People in this sub simply refuse to remove themselves from spec sheets and use context to form opinions,1
The price is awfully close to couple years old premium models Like I d pay 50 extra to get S23 over this easily Or just buy something cheaper then this,1
The D7200 D7350 are very much the same chip except just high clocked might just come from the same binned batch They also threw in some fluff like better selfie charging And upping the price just because,1
The battery life is significantly better,1
The Dimensity 8020 isn t any faster than the Snapdragon 7S Gen 3 in CPU and it s slower in GPU performance plus it s probably less efficient At least the Dimensity has AV1 decoding shame on Qualcomm at this point but the Moto Edge doesn t seem to have Ultra HDR support,1
how is the software experience does motorola filled their phones with bloatware like realme,1
There is a little bit more than just the telephoto but yeah I find it hard to justify the pro name and the 80 jump in price from 379 to 459 based on the spec sheet They are identical except for the telephoto camera 32MP vs 50MP selfie camera 8 128 vs 12 256 of RAM storage and 201 vs 211g in weight Nothing says the primary sensors are different as well but not enough info on that front,1
I have the 13 pro and it does have animation unless 14 pro is somehow special,1
How are those two devices even remotely comparable The market has shown that people would prefer a big phone when given a choice If you said the plus that would make sense but then again they are nowhere near a similar price,1
They re both 5000mAH Have you had both,1
Well we can agree about the circular camera but disagree about 13r vs 3a pro They re about the same to me haha but 13r is a better phone imo,1
Dimensity 8020 scores higher in Geekbench 6 multi core and slightly lower in single core In 3DMark it scores higher for GPU benchmarks compared to the 7s gen 3 8020 should be less efficient but keep in mind that it s an ancient SoC launched in 2021 and yet it s as fast as if not faster Which makes the 7s gen 3 look even worse in comparison Something like the Dimensity 8400 would run circles around it and you get that in phones cheaper than the Nothing 3A,1
Stock OS with no bloatware whatsoever,1
Animations are limited to the flagship devices on Realme What you have on 13 pro is app closing animations but not app opening animations for example same goes for 14 pro Just Google it or check r realme,1
I have the 2a Plus not both But every review I ve seen has the plus with a solid lead in battery life I left my 23U for the 2a Plus and it s SIGNIFICANTLY more efficient with its 5000mah,1
Would hope it was since it costs 120 more,1
Oh yeah it does What a disappointment from such a recent SoC,1
Oh wow I see Thank you,1
Interesting Why did you decide to switch from flagship s23u to 2a,1
I ve honestly kinda given up on finding an Uber Phone at this point and decided that the 1 thing I want out of a phone is battery life long enough that I genuinely don t have to worrying about making it through a day If I get off work 5pm and decide to meet up with friends afterwards I don t want to worry about topping off before I go I just want the BEST battery life possible on android If the phone feels smooth to operate and the camera captures pictures well enough and speakers don t sound like shit I m good Best I could tell the 2a Plus fit the bill best and since I ve been using it about 2 months now the battery life has been everything it was hyped up to be I actually went back the 23 ultra for a day or two just because I thought I d rather have the wireless charging with worse overall battery life but I was appalled by how quickly the battery drained and went right back to the 2a Plus,1
Is it wild that a phone released today doesn t have wireless charging Even newer cars today have wireless charging pads,1
UFS 2 2 Seriously,1
Interested to see how it compares with the upcoming OnePlus Nord 5 That one will most likely have a bigger battery and faster charging but I m not sure about the camera,1
7s Gen 3 is weaker than a 4 year old snap 8 gen 1 Let that sink in And they re advertising this phone as having flagship specs lol,1
Any details on camera HW beside mpx Like what sensors are they using Are they SONY or Samsung or Omnivision,1
the pixel 6a from what 3 years ago has ufs3 1,1
what would you choose between samsung a56 and 3a,1
I got real confused and thought Phone was Pixel like didnt that phone come out 10 years ago,1
And That Carl Pei guy has audacity to say as if done something praiseworthy and will touch the grass per his linkedin post,1
mediocre at best,1
Not even a Snapdragon 8 gen 3 no 80W fast charging and the battery of 5000 mAh is kinda just average in 2025 A serial dual cell battery setup would ve been awesome I was hoping it would ve been something that finally moved me over from the OnePlus Just make a 650 700 phone,1
guess they needed to cut corners somewhere and this was part of it how much could they be saving by not going for at least UFS 3 1,1
Where is this spec indicated In Italy it is marketed at 3 1,1
Is the display same as 2 a,1
What s the difference between periscope and non periscope zoom,1
No way really Are mid range chips this stagnant now This combined with UFS 2 2 is really disappointing I might just pick up a used Phone 2 instead,1
The ultrawide is Sony on both The main sensor is Samsung on both The Telephoto on the pro is Sony lyt 600 This was all in the community post I just shared,1
My educated guesses based on Mpx count sensor size details and info OP gave you 3a Main sensor Samsung GN9 Tele presumably Samsung JN5 UW Sony IMX355 Selfie Samsung KD1 3a Pro Main sensor Samsung GNJ Tele Sony LYT 600 UW Sony IMX355 Selfie Samsung JN1,1
I never used a nothing phone so I cant speak on experience But I did have a50 phone in the past I would go with the 3a based on specs and price over the a56 Since the a56 more expensive in most regions It does have a leg up over the 3a with 6 years of os security updates compared the 3a 3 os and 6 year security updates In my experience the a50 lags hard after the 2 or 3 os update Nothing s skin looks to be lighter in comparison Compare Samsung Galaxy A56 vs Nothing Phone 3a GSMArena com,1
It is not their flagship They said that Phone 3 will also release this year This one might have those features,1
It s a 380 dollar phone,1
Hell UFS 3 0 is 6 years old and while it was kind of an outlier and had compromises elsewhere Poco X3 Pro had UFS 3 1 for 249 back in 2021 But Nothing isn t unique in stubbornly sticking UFS2 2 to their midrange phones,1
