Complaint,Count
I quite like the duo both the 3a and 3a Pro I didn t mind the 3a Pro when I first saw it but I must say the triple camera setup on the 3a seems more advanced than the 2a s minion eyes while more designed more elegant than the 3a Pro That said I still vastly prefer the distinct glyph interface of the phone 1 and 2 I ve been looking to snatch one up in the states What will happen to the main line I hope they aren t dropping the large glyph lights for the 3a Pro series,1
3a looks quite nice honestly Still can t quite get around the 3a pro s camera setup though,1
The phone has significant colour shifting while changing between all 3 lenses lens flares lack of 4k in ultrawide and selfie camera no charger in box Besides that the value proposition is pretty good and the design is definitely striking The 3a pro has very little to justify it s higher price compared to the 3a imo,1
6 77 inch screen Are human hands getting bigger or is everyone legit just using their phones like tablets now,1
Why is there a 3a budget line but no 3 flagship,1
I wonder if the bootloader will be unlocked,1
Wish they also made a smaller version,1
I love the plastic back on my phone 2a plus It s grippy and weighs less Wished they kept going with it on their a series instead going the more premium route,1
You get what you pay for but at least it looks different,1
So when does the 3 drop,1
Was looking at their product page It s a bad sign when their example photos look really bad They re barely mid range A chip on par with the 870 and mediocre cameras This is a mid range phone from 2022 with AI slapped on,10
i m in the market for a mid range phone but looking at the specs i wonder if i will be better off getting nothing phone 2a,1
No wireless charging I can understand but 3 android updates is unforgivable,1
Almost bought 3a but no eSIM stopped me Need it when travelling The 3a Pro has it but I don t need the periscope camera so why pay so much extra for eSIM,1
Very elegant as expected,1
3a Pro looks worse to be honest,1
What was the point of using a periscope lens for a mere 3x zoom Don t other phones already have 3x zoom non periscope lenses,1
Should I get the 3a for like 23 000 in India or should I go for the OnePlus 12R for about 29 000 The 12R has killer hardware for the price but I m not a fan of the direction Oxygen OS has gone in I do love how nothing OS looks like but there s quite a few things lacking in the hardware section as well as the absence of a fast charger in the box and also no Alert Slider,1
I was looking at Nothing when I shopped around for a new phone but their stupid lack of NFC instantly excluded them from selection Good to see they ve fixed that part,1
No L5 and E5 gps I m disappointed,2
I do find it kinda shitty how they had a couple of youtube videos going on about how great the periscope camera in the Nothing 3a is only to finally reveal it and it s only on a 3a Pro which is a 150 more expensive,1
I wonder if they will drop prices to remain competitive against the Redmi Note 14 Pro 5G which you can pick up today for around 235 USD,1
How do we get Verizon to support this phone,1
wish they went with an 8gen2 or something else for the SOC,1
OnePlus Nord 4 is better,1
What s the best deal I can get on a 3a Any extensions credit card offers or anything whatsoever All suggestions welcome,1
No jack no buy,1
I dont think they are dropping the main line But you can get the 3a at launch in the States I just checked,1
Ultrawide seems like a downgrade,1
I am going to use minion eye as name for my 2a from now on,1
That look is growing on me,1
The pro camera bump is massive There s quite a number of phone with the same 1 1 56 main 1 1 95 periscope and their bumps are modest x200 find x8 gt7 pro 13pro 14pro,1
I think it looks a little better if you imagine it like a silly face,1
which phone would you suggests around that price with good camera,1
I think most people two hand their phones so the latter is the answer As a one hander I kind of hate it BUT that s been the nice thing about foldables can get both big and small screens in one device,1
I ve got very small hands I ve had to use phones almost exclusively with two hands since the Galaxy S3 If the phone will be impossible to use one handed for me either way might as well get as big screen as possible,1
I remember seeing the original galaxy notes 5 3 inch screen for the first time and laughing at the absurdity of it,1
Bigger phones makes it easier to watch videos imo I went from a Pixel 7 Pro 6 7 in to a Pixel 9 Pro 6 3 in and I miss my Pixel 7 Pro s screen size whenever I watch videos,1
you are in the minority especially for the budget segment if you want a relatively smaller phone you re gonna have to shell out for an iPhone or a Samsung S series,1
Same feeling Every phone I hear about these days is 6 7 inches minimum I would buy a Nothing compact phone in a heartbeat but Carl Pei himself said that there is no real market demand for one,1
Idk man I m struggling to find anything close to the size of my Pixel 4a these days I don t mind a slightly bigger screen but I can barely reach the top of my screen one handed as is,1
I remember times when HTC HD2 with its 4 3 inch screen was considered too big,1
my thoughts exactly lol I mean shit I m on a Pixel 6 by far the largest phone I ve ever owned and it s not that comfortable to use Would have 100 gone with something like these new nothing phones if they weren t bigger,1
Remember the original Note release getting slammed for it s MONSTER 5 3 screen Now even something like the Vivo X200 Pro mini is 6 3,1
Any 6 1 modern phone feels tiny to me I have a 6 6 phone and still wanted it to be bigger at least 6 9,1
I miss the old corner one hand mode My thumbs are too short to reach to the other side of the screen with the newer half a screen tall but still the same height one hand mode,1
Eh I get what you mean but you have to think of the new aspect ratios and the overall screen to body ratio 2025 6 7 phones are essentially the same physical size as 6 4 inch phones from 5 6 years ago and 5 8 6 0 from a decade ago,1
I went from a pixel xl down to the regular One handed was getting annoying with the xl phones,1
I wish 6 9 inch displays became the norm,1
I feel you this has been driving me nuts for years The only thing that helps a little is using one handed mode with my keyboard I think because more and more people are using their phones as their primary media device for gaming movies and TV bigger and bigger screens are often preferred It sucks,1
On the contrary I miss phones sizes like the Huawei Mate 20x with its 7 2 inch screen Something about consuming content on big screen makes it better,1
It s nice seeing things made that are usable for people above 5 5 in any product,1
it s insane the size of the smartphones at least samsung and pixel have flagship close to 6 inches,1
The 3 was supposed to come out last year But they pushed it back to develop their AI software more,1
ngl I though the nothing s design makes their phones look allot smaller than they actually are,1
Plastic is good as long as it doesn t feel cheap but have you held metal phone Now that s peak material,1
Wont lie dont know enough about the chipset to make a educated opinion But benchmark wise this chipset in other midrange phones gets beat out by oneplus 9 a phone released 4 years ago I guess you are paying a price premium for software support but id expect something a bit faster,1
Are you really bitching about a midrange phone with midrange specs selling for a midrange price Like you realize this isn t a flagship right,1
how big is the price difference in your region I think the 3a pro is competitive in the U S,1
2a has a cheap panel and blacks look green in dark rooms,1
Yes exactly the same here Need esim but no interest in the giant camera hump That decision will cost them some sales,1
yeah for 75 more I don t think the periscope telephoto is worth it compared to the normal 3a,1
He got a thick booty,1
A sensor around 3 times bigger than in non periscope 3x cameras,1
As the other guy said using periscope mechanism enable the oem to use bigger sensor if compared to non periscope mechanism,1
I d say the OnePlus 12R is definitely the better buy here Significantly better hardware for the same price Also OOS15 looks pretty cool and runs really well It s got some minor niggles here and there but overall it s a significant improvement over OOS14 I have a OnePlus 13,1
Not only there s no charger in box it charges very slowly 12R is much better phone at that price But it does have curved screen,1
I don t think I can give you a knowledgeable recommendation since I live in the states since my market is very different But if you re concerned about hardware here is a GSMArena link comparing both phones I hope this helps,1
Huh I have the 2a Plus and it has NFC,1
If I had a nickel for every time a phone starting an series associated with Carl Pei has no nfc I would have 2 nickels which isn t much but weird it has happened twice,1
Almost no midrange phone release have USB 3 0 Though they should make it illegal to still release any phone with USB2 0 nowadays,1
doesn t the nothing phone 2 use that,1
How does your Xperia 5 IV hold up,1
You know what else is MASSIVE,1
Depends on which market you re in in my market Moto edge 50 neo if camera is your priority Poco X7 Pro or Iqoo Neo 10R if performance is your priority,1
Interesting never thought about this So it seems that the people who really want small phones are those who could comfortably one hand formerly medium size phones And everyone else has adjusted to the current large phones every company sells,1
My wife laments the end of the iPhone Mini series Was hoping the 16e was closer to that size than it is,1
Screen size isn t the only important factor here Those old phones like the note 2 make modern phones look tiny on the width Attached is the size comparison of the Nexus 6 vs the modern giant s25 Ultra Nexus 6 vs S25 Ultra,1
The first cell phones were massive because the technology at the time restricted them from being small Then technology advanced in the cell phone got really small Then people figured out that you can watch porn on phones and then they got big again,1
And once you reach a certain age reading text on your phone is easier on larger phones,1
Why even call them phones anymore if their primary function is pocket video monitor We could abbreviate it poke mon,1
Xiaomi Motorola Google all have at least one small phone,1
I don t understand how there s not market for smaller phones in lower budget phones yet flagships from Samsung every year still have 6 2 model If that sell how come cheaper small phones don t I don t understand,1
There is market demand because Apple have both base iPhone and Pro iPhone Samsung have base S model Google have base Pixel a and non XL Pro Even Chinese oem like Vivo make 1 Oppo OnePlus rumoured to release 1 too following Xiaomi s base model,1
I assume the 6 3 screen of the Pixel 9 is still on the too large side,1
That s why I bought a S23 it was the most P4a ish sized phone with acceptable specs,1
Same wish they d make more midrangers at that size hell even make some 7 2 phones for media consumption,1
I wish we could stop having norms,1
Is that even a phone I looked it up looks like tablet lol,1
Ugh I m so sick of this forced AI trash The 3a 3a Pro having a button that basically just opens a voice dictation AI is fucking stupid I just hope the button is remappable to it s not a waste of space,1
Metal just feels more premium but still prefer plastic for practical reasons Metal gets too hot or cold and is more slippery,1
Are you capable of comprehending what i wrote I m complaining that it s a midrange phone from 2 3 years ago and priced as a new midrange phone I really wish some of you would learn to understand what you re reading instead of just making up whatever you want in your own head,1
i think here i can get a 2a for around 200usd thereabout,1
Genuinely might push me towards Motorola They have great availability here in AU and now offer 5 yrs of updates 2 more than Nothing and a near stock OS and eSIM on most models When they drop a successor to the Edge 50 Neo I ll probably cop as I don t want any of their curved models,1
Telephoto is a nice inclusion but really hinges on how well their isp tuning is since it s a debut for Nothing,1
Linus s quick comparison shows the selfie and rear shooters are remarkably better on the Pro,1
Thanks for the recco Ended up getting the 12R although bank discounts didn t apply for some reason and I paid 32 500 in total Still a good deal imo,1
Yeah not a fan of the curved screen Design wise the 3a is great but I need a balance of a nice design and solid specs which I think the 3a is lacking I m thinking to purchase the 12r for now and exchange for a flagship Phone 3 or Phone 4 in a year or two,1
Thanks Btw is the OnePlus 12R selling in the American market I thought it was exclusive to India,1
They were probably interested in the cmf phone 1,1
CMF 1 doesn t,1
It s really dumb I can t imagine making a daughterboard with USB 2 0 instead of 3 2 or whatever saves any meaningful amount of money I think for most brands it s just another way to artificially distinguish their lower tier options from their higher ones But Nothing has never made a phone with USB 3 x so I have some reason to doubt the Nothing Phone 3 will have it either,1
Phone 2 uses 8 gen 1,1
Decent phone but not my fav Probably better off in the hands of someone who knows how to operate a camera,1
Well the nothing phone 2 did get an American release Maybe look for old stock,1
Can I ask why the Glyphs seem to have such an appeal to you They re just a bit of a novelty for me on my Phone 1 which I ve been very happy with,1
Someone s maternal relative,1
many punch carpenter imminent apparatus summer waiting crown automatic bag This post was mass deleted and anonymized with Redact,1
Medium sized phones meant 3 5 screens at one point so you re technically correct,1
Even that was 5 4 Bigger than the original Galaxy Note,1
Yeah for some reason every single of these annoying small phone fans just completely ignore the concept of huge freaking bezels and aspect ratios,1
Very impressive Now do the normal S25 with the HTC Dream and Nexus One,1
Because that s what they started out as and continue to be lost peoples primary line of communication I E We have phone numbers There is no primary function in smartphones i think smart devices or even just devices are better names they are powerful multifunctional mobile computers They do everything So you may as well call them by their original primary function which continues to be somewhat exclusive to these devices,1
Name one Because a small phone is around 5 at this point,1
If that sell how come cheaper small phones don t I don t understand Smartphones are not just the primary but in many many cases the only computing device people own obviously it mainly happened in developing countries initially but IMO it s increasingly the case in developed ones as well If phone is your main device with which you not only do boring stuff like pay for things or log into work related apps but also endlessly scroll through websites and social media pull up recipes when cooking watch videos or even movies TV shows you want the screens to be as big as possible Poorer people are more likely to not own any bigger device like a tablet laptop or a desktop so they on average want the biggest phone possible,1
As far I know Motorola is the only one that release small midrange phone Even that phone isn t really small having 6 4 screen,1
That s right Samsung is one of the only ones who do that anymore Apple used to do it until they abandoned the mini Pixel s a line still does a relatively smaller one but it could go up to 6 3,1
For me personally yes but in the future if I have to upgrade and if literally no other choice exists but that size I ll pick it I still have a Pixel 5a and at 6 34 inches it s hard to use and doesn t fit in my pocket very well,1
What s your opinion about the s23 I m a pixel 4a owner and there s literally nothing like it around in terms of size weight and specs but after that awful January update I want need to switch,1
I feel like I am the only person with all of that shit disabled as much as possible,1
That has a MediaTek chip I m not as well versed in their low end midrange chips Maybe look around nothing s 2a community with how the chip has held up,1
just get OP 13,1
Another phone you can consider is OnePlus Nord 4 That one should be even cheaper,1
Yeah it s sold in the u s just before the 13r got released We were getting pretty good discounts with the top tier was selling for 500 which is a solid deal imo,1
Ah alright Well with all due respect that s a cheap low end phone many of those don t have NFC,1
Honest answer is that it will not be my primary device and I want it for the soft surround lighting that I use on a nightly basis A regular smartphone flash light works fine but I sometimes catch the reflection off glossy surfaces and mirrors around the house and it s annoying I ll admit my situation is rather unique and I can t explain it much better than that I sometimes just want to use the phone s flashlight instead of turning on the lights around the house at night But the glyphs offer a nice middle ground for soft fill lighting that sounds appealing to me I may be willing to spend 379 for that novelty or preferably less for a used phone 1 2 but likely not more than that I m currently using an S24 and I much prefer the smaller size for a secondary device Like my Pixel 6 Pro the Nothing Phones all are a bit too wide and heavy for my taste as a primary device but I would like to get a used phone 1 for cheap and get full glyph lighting,1
Yes and no really Even tho yes the screen size is bigger in numbers because of changes in aspect ratio and screen to body radio the iPhone 13 mini physically smaller than the Note or Note 2 Using 19 5 9 or something similar combined with the fact that the bezels aren t enormous means that it still qualifies as a small phone even with screen sizes getting bigger Yes its still bigger than an iPhone 4 and stuff like that but those were literally tiny and a 3 5 phone would be miniscule in a modern aspect ratio and small bezels The of the screen doesn t give you the full information without knowing the size of the bezels and the aspect ratio the phone is using Which is why 5 5 in 2013 is huge whereas 5 5 in 2025 is very small This is why stuff like the phonearena size comparison tool is useful for comparing phones that are theoretically the same size but not in practice A Note or Plus or XL or Ultra or Max phone is always going to be big for its time in same way a Mini or Compact phone is always going to be small for its time,1
No we don t I have a 6 3 inch phone and it is massive I cannot one hand this thing like I easily could with older smaller phones Quit bsing about aspect ratios and bezels Modern phones are huge Even that nexus 6 is big with a 6 inch screen that he s comparing to I still have my old phones and there is just no comparison to the size and weight of my current phone,1
Yeah that s crazy I really don t think I could enjoy any app on something that small these days Some of it is my eyes have gotten old,1
Can you share the app website you used for the comparison,1
Unihertz Jelly Max,1
Pixel 9 is 6 3,1
I m happy with it nothing to complain about,1
It s the first thing I did when I set up my new phone If you re on a Pixel there s AI Core AI Wallpaper and Android System SafetyCore to disable or uninstall in your apps list At least on the 9 series I assume older as well though,1
That device got a lot of traction and had many people interested in trying Android with it It was one thing that people had to have nowadays,1
Some of the chinese brands have nfc in their budget phones,1
I feel there must be alternative torches or night lights you could look into but hey it s your money,1
There are two conversations worth having Small phones have gotten really huge and are not all that small I agree with that The conversation I was having was that big phones back in the day were pretty fucking wide when compared to modern big phones,1
THANK you The Nexus 6 was marketed as a Phablet same as the Galaxy Note and small phone fans like myself were already complaining about the size of the Nexus 5,1
A great suggestion but not from those three companies lol,1
I own a Jelly Star which is even smaller Downside is bizarre boot loop issues on occasion and absolutely 0 software updates,1
I wouldn t say Pixel 9 is a midrange Tbh Pixel 8a deserve more if you want to put it,1
OK but in terms of comment OP I was originally replying to talking about fixing that part and stupid lack of NFC it s not necessarily because Nothing hates NFC OP surely has seen other non Chinese phones in that price range not have NFC either I don t understand how it makes sense to talk about fixing NFC in the 3a after only having looked at the low end option,1
They have NFC in phones cheaper than the CMF Phone 1 Real shame they left it out,1
Yeah definitely but I feel like it s my way to justify adding a quirky phone to my collection,1
There literally is nothing from those three companies,1
Yeah even Samsung has NFC in phones cheaper than the CMF 1,1
3a Pro Basically the Nothing Phone 3,1
The 3a camera module is just weird The 3a Pro looks fine I like both but I get that tech styles like this aren t everyone s cup of tea,1
Well it sure is unique,1
I like it,1
They are so over priced in my country,1
For once I d love a phone that s just a slab Professional cameras Great software Slab camera bump gone,1
they got rid of the micro sd,1
Looks like they asked Carl Pei s kid to position the camera lenses,1
Good lord that is ugly,1
Selling a phone with an 8MP camera sensor in 2025 is a crime What were they thinking,1
Rectangle with camera woooo All that being said I think Pixels are the best looking phones so far The rumored iPhone redesign even attempts to look more like them I think phones have pretty much reached their end state and it s a mature market now The cameras are all good enough processing power is all great other than some extremely demanding games but does anyone really wanna play Re4 remake on their tiny phone screen The steam deck and switch and the like are just better experiences for that I don t see where phones can really improve from here by much Perhaps just focusing on battery and efficiency and making them last a week without charging It doesn t bother me much plugging it in at night I think the next frontier for tech is 100 going to be something along the lines of the vision pro or those meta smart glasses The idea I have is of having that battery pack cable they have and being able to plug into a phone and use that device s battery and processing power to be able to offload more from the glasses But the prospect of full on computing shared AR experiences not needing monitors anymore That would be something,1
Hmm weird button placement I m not a fan,1
Certainly different It s not for me but it is a different type of design that I m sure others will find appealing,1
So now we have a 2a 2a plus and 3a 3a PRO Will there be a 3a plus pro or pro plus as well,1
They look cool The naming scheme makes zero sense though 3a Pro Like a midrange phone but pro,1
Nothing is so infatuated with these little drip releases Say what you will about the pixels leaks or whatever but I think it s nice that you basically know what you re getting so you can make an informed purchasing decision,1
that s the ugliest fucking thing ive ever seen,1
i think the nothing phone is the dumbest android smartphone by far hey lets bring back the notification light back only on the back bingo lets make millions any other idea s 2 usb ports no sim loads of storage switchable battery na just a light on the back just that genius,1
They look cool and all but the amount of people I have seen complaining about screen issues like green tint and black crush sometimes both on the same phone and weird bugs and UI issues like lag and stutters Why spend money on these when Samsung Oppo and other manufacturers offer you more for less The led lights will most likely loose their charm in a week The performance of the device matters in the long term and SHORT term,1
It s kind of clicked now When that first quirky Nothing phones released I thought it was cool but I still preferred the neater looking competitors But not that it s been a few years I am so fucking bored of them Will await the price but this is on my radar this year,1
So does anyone actually seriously use the glyph lights,1
I still don t quite get Nothing s USP market approach I love having more competitors in the space and appreciate their hardware aesthetic but otherwise they re just building extremely mediocore phones using off the shelf parts with a basic and extremely unappealing ugly Android skin And I guess some lights on the back That s kinda it I just don t really understand why you d buy one vs the myriad of other devices on the market which are far more competitive Carl talks as if they ve got these groundbreaking things coming but every release is as dull as the next,1
Why is the camera looking so bulky I always thought my Pixel 6 s camera would stick out too much This looks like it s even worse and it s also a mechanical mechanism that rotates so that is another potential failure,1
Why more than 6 3 Just why,1
Never understood why people like this brand so much just because of their name,1
Anyone know if it shoots in RAW,1
I am a bit confused does the 3a pro replaces the 3pro,1
it s so damn ugly looks like a smarphone made by AI,1
