Complaint,Count
Balancing size and quality Phone 3a and Phone 3a Pro s displays are immersive and brilliant At 6 77 inches their flagship size means on screen content has room to breathe Slightly taller and with less rounded corners than past Nothing phones Phone 3a Series displays represent a maturity and confidence befitting of a second generation device At Full HD resolution visuals look crisp with 387 pixels in every inch of screen and with a fluid 120Hz adaptive refresh rate The standard touch sampling rate is 480Hz a 100 increase from Phone 2a and 1000Hz touch sampling rate when in Gaming Mode swiping through Phone 3a Series is smooth and responsive Fire up auto brightness and your Phone 3a climbs up to 1300 nits all by itself making it viewable under a scorching sun But peak brightness now reaches 3000 nits a 131 increase from Phone 2a nothing community,1
periscope is a lens design that allows for bigger lens sensors by putting them on their side This allows phones to have better quality at longer ranges While a non periscope is set up normally like a main sensor The issue is that it s feasible with telephoto lengths and have good quality,1
I actually believed they would make a mid high range phone Maybe I expected too much for the 3rd iteration Not saying it s not a good value for those who aren t power users but I would love a 5400 5600mAh phone with fast charging in the form of a Nothing phone,1
Thank you I keep waiting,1
Damn thanks for your source 3a got WAY less interesting now,1
Sorry if my question wasn t clear I am more concerned about display type they used in 2a it s the worst OLeD I have ever used under low brightness I couldn t watch any content at all it all looks masked or smeared especially when it s dark room and content is also dark and phone brightness set to low Many posts in nothing subReddit regarding the same,1
If you don t care about the tele camera then it s straight up worse in that department selfie camera is also a lot smaller and still only does 1080p video,1
The 3a does support fast charging from what their website is showing,1
That will probably be their Nothing Phone 3 This is successor to the 2a,1
That really isn t a big deal unless you plan on frequently moving files between your phone and computer Most networks will limit you before UFS 2 2 chips throttle Even then write speeds hover around 250MB s It would only take a few seconds to transfer an HD movie If you re using an inexpensive 2 0 cable the transfer speeds of the cable will throttle anything over UFS 2 2 as well,1
Oh I m sorry I don t know I would say look at the reviews Maybe they talk about that,1
It looks to be a new and much improved panel in the 3a Green tinge in low light is gone,1
Np and good luck on your phone search journey,1
His point in this video about Nothing being unique for not gatekeeping zoom telephoto lenses behind premium models was so spot on Hopefully it sets a direction for the rest of the industry I have no need for a high end SoC but do need longer focal lengths,1
The limited availability in the US is a bummer just because There s enough competition at this price point where it s probably going to be a deal break So many limited features and band support I understand their motivations though it s expensive to enter the US market and it s so dominated by Apple and Samsung that there s not that much to gain So I understand it But it s a shame because this would be on a short list but the limitations just would make it hard to stand up next to a 12R or a 13R or a 9a or a Moto razr,1
MQB jumped the shark so high you re gonna need a bigger shark,1
Marques has reviewed pretty much everything including that cheap smartwatch Nothing has made At this point he s either an investor in Nothing or he really owes Carl Pei,1
Marques seems to make a video on pretty much every nothing phone I guess they do really well,1
What was it that he did said that jumped the shark,1
Or maybe in a smartphone era where reviews of the major manufacturers Apple Samsung and Google have essentially been same phone last year with AI and 100 200 dollars more expensive Nothing makes for better content during off season,1
You know OEMs send phones for free to reviewers right,1
It s a marketing for them They send a phone MKBHD reviews it Even if its average like 7 10 its a win for them I like these new phones might try and make a switch from Poco F5 I reeeaaaally like the blue color but after not liking my blue poco very much I might opt for black one,1
Could be the Panels wallpaper thing Or driving fast in a restricted area Unless there was another one which I missed,1
Yeah except he also just reviewed the iPhone 16e and Powerbeats Pro 2 He s also skipped a lot of devices over the past few months like the Vivo X200 Pro Oppo Find X8 Pro Galaxy Z Fold 6 Xiaomi 15 Ultra Oppo Find N5 even the new Razr s among many others His Apple bias has long been evident and it has nothing to do with views at this point and the person you replied to made a fair point that Nothing benefits from a similar bias,1
Are you serious You mean MKBHD gets these phones for free from different manufacturers but then decide to review every device made by Nothing but then refuse to review a OnePlus flagship device,1
It s a marketing for them They send a phone MKBHD reviews it What a novel strategy I m sure no other company has done this before s Seriously though he has a choice on whether to review the products or not and Nothing along with Apple are the only companies he seems to review every product they offer,1
You think there s a company out there that doesn t send their phones to Marques At the end of the day if Marques doesn t think the videos will perform then he simply won t invest the time and money into making them There s a reason he doesn t make a video on every poco phone for example,1
Most of the phones you listed won t be officially available in his country,1
Yes why are we talking about MK and not the phones,1
He reviewed the Oneplus phone though is he paid by then also,1
Other than the 15 Ultra and Find N5 he has access to the others either via the market or review samples He s already shown that he has both the Find X8 Pro and X200 Pro he mentioned them in his smartphone awards video Equally CMF by Nothing only sells their products in the US via Amazon yet that hasn t stopped him from giving the CMF Phone 1 his value award,1
You tell me,1
He reviewed the Oneplus phone though is he paid by then also Don t be an idiot He had to walk back by his refusal to review OnePlus 12 after people called him out for reviewing a new iPhone colour and not a OnePlus flagship He had no qualms about reviewing OnePlus devices until Carl Pei left the company Suddenly he s too busy to review OnePlus phones but has the time to review every device that Nothing makes including a budget smartwatch that only 3 people in the US would be buying,1
you talking about Marques and not the phone specs performance,1
It s a really good upgrade I d say But personally I would look at other alternatives if they better tickle my fancy,1
for processing no doubt 7 is cool i am confused regarding camera specs in real world scenarios for photography and videography,1
Depends on what you need If u want high performance heavy gaming and high battery go for infinix gt20 pro Nothing phone 3a is more like a casual phone or your daily driver It has decent camera great OS and decent battery So choose if you are heavy gaming or just your everyday phone,1
Win for the 3a imo The only thing I don t know about is if you re doing heavy gaming But I think in terms of CPU there s not a big difference between the two,1
enough for what what do you mean,1
I have never had nothing phone so I am thinking if it is a downgrade from a 888 processor,1
Normal phone tasks yes Gaming Not so much,1
Seems a little weak for the price I assume I am intrigued by it the cameras the os the battery but seems in the same league as my old realme GT2 I don t play games but I like the smooth experience by a fast processor,1
More than good enough for regular gaming and emulation just not the best option for the most demanding games Nothing phones usually have good cooling which is also great for longer gaming sessions,1
